{"$schema":"https://json-schema.org/draft/2020-12/schema","$id":"https://synergy-system.local/schemas/synergy.economic-cycle-v1.json","type":"object","additionalProperties":false,"required":["schema","cycle_id","generated_at","authority","accounting_authority","settlement_authority","governance_authority","ai_authority","execution_authority","blockchain_submission_authority","protocol_status","canonical_merge_status","trust_finalization","live_execution_claim","repository_bindings","lifecycle","economic_invariants","reference_vectors","blockers","digest"],"properties":{"schema":{"const":"synergy.economic-cycle/v1"},"cycle_id":{"type":"string","minLength":1},"generated_at":{"type":"string"},"authority":{"const":"SYNERGY_SYSTEM_PROVENANCE_ONLY"},"accounting_authority":{"const":"Shtenco/synergy_financial_os"},"settlement_authority":{"const":"Shtenco/synergy_pay_system"},"governance_authority":{"const":"HUMAN_COMMITTEE_OR_MULTISIG_ONLY"},"ai_authority":{"const":"NONE"},"execution_authority":{"const":"NONE"},"blockchain_submission_authority":{"const":"NONE"},"protocol_status":{"const":"E2E_PROTOCOL_DAG_CLOSED_NOT_LIVE_EXECUTED"},"canonical_merge_status":{"const":"STACKED_PR_CANDIDATE_NOT_MERGED"},"trust_finalization":{"const":"EXTERNAL_COMMITMENT_REQUIRED"},"live_execution_claim":{"const":false},"repository_bindings":{"type":"object"},"lifecycle":{"type":"array","minItems":12,"maxItems":12,"items":{"type":"object","required":["ordinal","phase","owner","schema","required"],"properties":{"ordinal":{"type":"integer","minimum":1,"maximum":12},"phase":{"type":"string"},"owner":{"enum":["Shtenco/synergy_financial_os","Shtenco/synergy_pay_system"]},"schema":{"type":"string"},"required":{"const":true}},"additionalProperties":false}},"economic_invariants":{"type":"object"},"reference_vectors":{"type":"object"},"blockers":{"type":"array","minItems":4,"maxItems":4,"uniqueItems":true,"items":{"type":"string"}},"digest":{"type":"string","pattern":"^[0-9a-f]{64}$"}}}